{
  "$schema": "https://json-schema.org/draft/2020-12/schema",
  "$id": "https://adp.dev/schema/delegation-event.schema.json",
  "title": "DelegationEvent",
  "type": "object",
  "additionalProperties": false,
  "required": ["specVersion", "delegationId", "sequence", "time", "kind"],
  "properties": {
    "specVersion": { "const": "0.1" },
    "delegationId": { "type": "string", "minLength": 1 },
    "sequence": { "type": "integer", "minimum": 0 },
    "time": { "type": "string", "format": "date-time" },
    "kind": {
      "enum": [
        "submitted",
        "accepted",
        "rejected",
        "working",
        "progress",
        "artifact",
        "input_required",
        "resumed",
        "completed",
        "partial",
        "failed",
        "cancelled",
        "budget_exhausted"
      ]
    },
    "message": { "type": "string" },
    "artifact": { "$ref": "artifact.schema.json" },
    "inputRequired": { "$ref": "input-required.schema.json" },
    "result": { "$ref": "delegation-result.schema.json" },
    "metadata": {
      "type": "object",
      "additionalProperties": { "type": "string" }
    }
  },
  "allOf": [
    {
      "if": {
        "properties": { "kind": { "const": "input_required" } },
        "required": ["kind"]
      },
      "then": {
        "properties": { "inputRequired": {} },
        "required": ["inputRequired"]
      }
    },
    {
      "if": {
        "properties": { "kind": { "const": "completed" } },
        "required": ["kind"]
      },
      "then": {
        "properties": {
          "result": {
            "allOf": [
              { "$ref": "delegation-result.schema.json" },
              {
                "type": "object",
                "properties": { "status": { "const": "completed" } }
              }
            ]
          }
        },
        "required": ["result"]
      }
    },
    {
      "if": {
        "properties": { "kind": { "const": "partial" } },
        "required": ["kind"]
      },
      "then": {
        "properties": {
          "result": {
            "allOf": [
              { "$ref": "delegation-result.schema.json" },
              {
                "type": "object",
                "properties": { "status": { "const": "partial" } }
              }
            ]
          }
        },
        "required": ["result"]
      }
    },
    {
      "if": {
        "properties": { "kind": { "const": "failed" } },
        "required": ["kind"]
      },
      "then": {
        "properties": {
          "result": {
            "allOf": [
              { "$ref": "delegation-result.schema.json" },
              {
                "type": "object",
                "properties": { "status": { "const": "failed" } }
              }
            ]
          }
        },
        "required": ["result"]
      }
    },
    {
      "if": {
        "properties": { "kind": { "const": "cancelled" } },
        "required": ["kind"]
      },
      "then": {
        "properties": {
          "result": {
            "allOf": [
              { "$ref": "delegation-result.schema.json" },
              {
                "type": "object",
                "properties": { "status": { "const": "cancelled" } }
              }
            ]
          }
        },
        "required": ["result"]
      }
    },
    {
      "if": {
        "properties": { "kind": { "const": "budget_exhausted" } },
        "required": ["kind"]
      },
      "then": {
        "properties": {
          "result": {
            "allOf": [
              { "$ref": "delegation-result.schema.json" },
              {
                "type": "object",
                "properties": { "status": { "const": "budget_exhausted" } }
              }
            ]
          }
        },
        "required": ["result"]
      }
    },
    {
      "if": {
        "properties": { "kind": { "const": "rejected" } },
        "required": ["kind"]
      },
      "then": {
        "properties": {
          "result": {
            "allOf": [
              { "$ref": "delegation-result.schema.json" },
              {
                "type": "object",
                "properties": { "status": { "const": "rejected" } }
              }
            ]
          }
        },
        "required": ["result"]
      }
    }
  ]
}
