{"specVersion":"0.1","delegationId":"rate-limit-42","sequence":4,"time":"2026-01-15T12:00:00Z","kind":"input_required","message":"Clock behavior is ambiguous.","inputRequired":{"delegationId":"rate-limit-42","requestId":"clock-choice","reason":"Two public API choices satisfy the objective.","question":"Should the limiter accept an injected clock?","inputSchema":{"type":"boolean"},"deadline":"2026-01-15T13:00:00Z","defaultBehavior":"Fail without making API changes.","remainingBudget":{"totalTokens":12000,"wallClockMs":400000},"resumeToken":"resume_6ef21cb8235d8f8a"}}
